userId,title,content,category,image,likes
1,Bienvenidos a CryptoHub,Este es nuestro espacio para compartir conocimiento sobre criptomonedas de forma libre y colaborativa. ¡Empecemos a construir juntos!,pregunta,https://picsum.photos/800/400?random=1,"[2,3,4,5]"
2,Análisis BTC: Resistencia clave en $35000,Bitcoin está testeando la resistencia de $35000. Los indicadores RSI muestran sobrecompra pero el volumen sigue siendo fuerte. ¿Rompimiento o corrección?,análisis,https://picsum.photos/800/400?random=2,"[1,3,5,7,9]"
3,Cómo configurar MetaMask paso a paso,Tutorial completo para instalar y configurar MetaMask en Chrome. Incluye creación de wallet y conexión a diferentes redes.,tutorial,https://picsum.photos/800/400?random=3,"[1,2,4,6]"
4,Mi experiencia con staking de Ethereum,Después de 6 meses haciendo staking de ETH estas son mis conclusiones: rendimientos estables pero hay que considerar el lock-up period.,experiencia,,"[1,2,5,8,10]"
5,¿Vale la pena invertir en altcoins en 2025?,Estoy empezando en crypto y me pregunto si debería diversificar hacia altcoins o mantenerme solo en BTC y ETH. ¿Qué opinan?,pregunta,,"[2,3,6,7]"
6,Ethereum 2.0: Análisis post-merge,El merge fue exitoso pero ¿qué viene ahora? Analizamos las métricas post-transición y el impacto en el precio de ETH.,análisis,https://picsum.photos/800/400?random=6,"[1,4,7,9,11]"
7,Comprar tu primera cripto en Binance,Guía detallada para registrarse en Binance verificar cuenta y realizar tu primera compra de Bitcoin de forma segura.,tutorial,https://picsum.photos/800/400?random=7,"[2,3,5,8]"
8,Perdí dinero con LUNA ¿qué aprendí?,Mi experiencia con el colapso de Terra Luna. Errores que cometí y lecciones aprendidas para el futuro.,experiencia,,"[1,3,6,9,12]"
9,¿Cardano tiene futuro en 2025?,Con tantas blockchains compitiendo ¿creen que ADA puede recuperar relevancia? Me interesa conocer opiniones técnicas.,pregunta,,"[4,5,7,10]"
10,Solana: Velocidad vs Descentralización,Análisis técnico de la blockchain de Solana. Alta velocidad de transacción pero ¿a qué costo en términos de descentralización?,análisis,https://picsum.photos/800/400?random=10,"[2,6,8,11,13]"
11,Crear wallet de papel para Bitcoin,Tutorial para generar y usar una paper wallet de Bitcoin. Método offline para máxima seguridad de tus BTC.,tutorial,,"[1,3,7,9]"
12,Gané 300% con DeFi el año pasado,Mi experiencia en protocolos DeFi durante el bull market. Estrategias que funcionaron y riesgos que asumí.,experiencia,https://picsum.photos/800/400?random=12,"[2,4,8,10,14]"
13,¿Cuál es la mejor exchange para principiantes?,Necesito recomendaciones de exchanges para alguien que recién empieza. Priorizo seguridad y facilidad de uso.,pregunta,,"[1,5,8,11]"
14,XRP vs SEC: Análisis del caso legal,Estado actual del caso legal entre Ripple y la SEC. Implicaciones para el precio de XRP y el sector crypto en general.,análisis,,"[3,6,9,12,15]"
15,Staking pools: Cómo elegir la mejor,Comparativa de diferentes staking pools. Factores a considerar: comisiones uptime y reputación del validador.,tutorial,https://picsum.photos/800/400?random=15,"[2,4,7,10]"
16,Mi primer año en crypto: reflexiones,Balance de mi primer año invirtiendo en criptomonedas. Aciertos errores y planes para el futuro.,experiencia,,"[1,5,9,13]"
17,¿Bitcoin llegará a $100000 este año?,¿Qué opinan sobre las predicciones de precio para Bitcoin? ¿Es realista llegar a $100k en 2025?,pregunta,,"[3,6,8,14]"
18,Análisis on-chain: Métricas clave de Bitcoin,Deep dive en las métricas on-chain más importantes para analizar Bitcoin: MVRV NVT y active addresses.,análisis,https://picsum.photos/800/400?random=18,"[2,7,11,15]"
19,Configurar nodo completo de Bitcoin,Guía técnica para configurar y ejecutar tu propio nodo completo de Bitcoin. Contribuye a la descentralización de la red.,tutorial,,"[1,4,8,12]"
20,Cómo perdí 2 BTC por no usar cold storage,Error grave: mantuve mis bitcoins en exchange y me hackearon la cuenta. La importancia del almacenamiento en frío.,experiencia,,"[2,5,9,13,15]"
21,¿Polygon es una buena inversión a largo plazo?,Con la competencia de otras layer 2 ¿creen que MATIC tiene futuro? Busco análisis fundamentales.,pregunta,,"[3,7,10,14]"
22,Ethereum killer o complemento: Análisis de competidores,Revisión de blockchains que compiten con Ethereum: Solana Cardano Polkadot. ¿Reemplazo o coexistencia?,análisis,https://picsum.photos/800/400?random=22,"[1,6,11,12]"
23,DeFi para principiantes: Conceptos básicos,Introducción al mundo DeFi: qué es yield farming liquidity mining y cómo empezar sin grandes riesgos.,tutorial,https://picsum.photos/800/400?random=23,"[2,8,9,15]"
24,Mi experiencia minando Ethereum (antes del merge),Recuerdo de mis días minando ETH con GPUs. Costos beneficios y la transición a Proof of Stake.,experiencia,,"[4,7,10,13]"
25,¿Dogecoin es una inversión seria?,Entre memes y especulación ¿DOGE tiene fundamentos sólidos? ¿O es puro sentimiento del mercado?,pregunta,,"[1,5,11,14]"
26,Binance Smart Chain vs Ethereum: Comparativa,Análisis técnico y económico entre BSC y ETH. Costos velocidad y ecosistema de cada blockchain.,análisis,,"[3,6,12,15]"
27,Crear tu propio token ERC-20,Tutorial paso a paso para crear y deployar tu propio token en Ethereum usando Solidity y Remix.,tutorial,https://picsum.photos/800/400?random=27,"[2,7,8,9]"
28,Perdí acceso a mi wallet: historia de terror,Cómo perdí la seed phrase de mi wallet y los intentos por recuperar mis fondos. Lección cara pero valiosa.,experiencia,,"[1,4,10,13,15]"
29,¿Cuándo es buen momento para hacer DCA?,Estrategia de Dollar Cost Averaging en crypto. ¿Cada semana cada mes? ¿Qué frecuencia recomiendan?,pregunta,,"[5,8,11,14]"
30,Análisis técnico: Patrones en gráficos crypto,Guía de patrones técnicos más comunes en trading crypto: triángulos banderas y soportes/resistencias.,análisis,https://picsum.photos/800/400?random=30,"[2,6,9,12]"
31,Conectar hardware wallet a DeFi,Tutorial para usar Ledger/Trezor con protocolos DeFi manteniendo la seguridad de tus fondos.,tutorial,,"[3,7,10,15]"
32,Mi peor trade: FOMO en ATH,Historia de cómo compré en el pico por FOMO y las lecciones de gestión emocional que aprendí.,experiencia,,"[1,4,8,13]"
33,¿NFTs tienen futuro más allá del arte?,Los NFTs evolucionaron más allá de jpegs caros. ¿Ven utilidad real en gaming utilidades y membresías?,pregunta,,"[5,9,11,14]"
34,Avalanche: La blockchain de los subnets,Análisis de la arquitectura única de Avalanche y su enfoque de subnets. Ventajas competitivas y casos de uso.,análisis,,"[2,6,12,15]"
35,Yield farming seguro: Estrategias conservadoras,Cómo hacer yield farming minimizando riesgos. Protocolos establecidos y diversificación de pools.,tutorial,https://picsum.photos/800/400?random=35,"[3,7,8,10]"
36,Sobreviví al crypto winter 2022,Mi experiencia durante el bear market: estrategias para mantener la cordura y seguir acumulando.,experiencia,,"[1,4,9,13,15]"
37,¿Layer 2 de Bitcoin vs Lightning Network?,Comparando diferentes soluciones de escalabilidad para Bitcoin. ¿Cuál tiene mejor adopción y futuro?,pregunta,,"[5,8,11,14]"
38,Chainlink: El oráculo del ecosistema crypto,Análisis del rol crucial de LINK en DeFi y su importancia como infraestructura del ecosistema.,análisis,https://picsum.photos/800/400?random=38,"[2,6,7,12]"
39,Impuestos en crypto: Guía práctica,Tutorial sobre obligaciones fiscales con criptomonedas. Cómo declarar trades staking y airdrops.,tutorial,,"[3,9,10,15]"
40,Mi estrategia de portfolio cripto 2025,Cómo distribuyo mi portfolio entre BTC ETH altcoins y stablecoins según mi tolerancia al riesgo.,experiencia,,"[1,4,8,11,13]"
41,¿Cosmos es el internet de blockchains?,El ecosistema Cosmos y su visión de interoperabilidad. ¿Logrará conectar todas las blockchains?,pregunta,,"[5,7,12,14]"
42,Uniswap vs SushiSwap vs PancakeSwap,Comparativa de DEXs más populares: liquidez fees tokenomics y experiencia de usuario.,análisis,,"[2,6,9,15]"
43,Crear DAO paso a paso,Tutorial completo para crear una DAO: governance tokens propuestas y votaciones descentralizadas.,tutorial,https://picsum.photos/800/400?random=43,"[3,8,10,11]"
44,Cómo el crypto cambió mi vida,Reflexión personal sobre el impacto de las criptomonedas en mi situación financiera y perspectiva del dinero.,experiencia,,"[1,4,7,13,15]"
45,¿Qué opinan de los meme coins?,Entre DOGE SHIB y los nuevos meme coins ¿hay alguna lógica de inversión o es pura especulación?,pregunta,,"[5,9,12,14]"
46,DeFi 2.0: Evolución del ecosistema,Análisis de las nuevas primitivas DeFi: protocol-owned liquidity ve-tokenomics y sustainability.,análisis,https://picsum.photos/800/400?random=46,"[2,6,8,11]"
47,Cold storage: Mejores prácticas de seguridad,Guía completa de almacenamiento en frío: hardware wallets paper wallets y configuraciones multisig.,tutorial,,"[3,7,10,15]"
48,Mi primer trade exitoso en crypto,Historia de mi primer trade rentable análisis de la oportunidad y factores que contribuyeron al éxito.,experiencia,,"[1,4,9,12,13]"
49,¿Web3 es el futuro o solo hype?,Más allá de las criptomonedas ¿la visión de Web3 descentralizada se materializará o es marketing?,pregunta,,"[5,8,11,14,15]"
50,Bitcoin en países con alta inflación,Análisis del uso de Bitcoin como reserva de valor en países con crisis monetarias. Casos Argentina y Venezuela.,análisis,,"[2,6,7,10,12]"